Title;Speaker;Place;Day;Time;Description
The fine art of negotiating for data;Ellen Gabler, Andrew Lehren, Joanna Lin,;Grand Ballroom West;Saturday;11 a.m. - 11:50 a.m.;**Moderated by Ellen Gabler, Milwaukee Journal Sentinel
A picture of Earth through time: Storytelling with Google Earth Engine;Vanessa Schneider, Randy Sargent;Chesapeake;Saturday;11 a.m. - 11:50 a.m.;Covering science stories, love building maps, or just want to see something really cool? Working with the USGS and NASA, Google released more than a quarter-century of images of Earth taken from space, compiled into an interactive timelapse map. News outlets around the world have been using this stunning imagery to localize stories about urban growth, deforestation and more. Here's a rundown of the session, for both developers and non-developers: First, we'll walk you through how we built our timelapse map, then demo how to easily embed it on your website. Next, we'll show you how to create custom tours with the imagery using a special editing tool we built for storytellers. Finally, we'll demo Earth Engine, Google's geo data analysis platform, the core technology used to compile the timelapse imagery. Developers in the room will have the opportunity to sign up to be Trusted Testers for Earth Engine's advanced geo data analysis tools.
People and patterns: The network behind the story;Valdis Krebs;Salon DEF;Saturday;11 a.m. - 11:50 a.m.;
Ruby 3: Simple web apps with Ruby;Jacqui Maher;Salon A;Saturday;11 a.m. - 11:50 a.m.;
"PostGIS &amp; CartoDB";Andrew Hill, Michael Keller;Stadium 4;Saturday;11 a.m. - 11:50 a.m.;
Joining tables with SQL;TBA;Stadium 2;Saturday;11 a.m. - 11:50 a.m.;
Examining prescribing patterns (Phil Meyer Award winner);Jennifer LaFleur, Charles Ornstein;Salon BC;Saturday;11 a.m. - 11:50 a.m.;
"It&#39;s not just for looks: Presentation as a story-telling tool";Alyson Hurt, Aron Pilhofer, Helene Sears, Chrys Wu;Grand Ballroom East;Saturday;11 a.m. - 11:50 a.m.;**Moderated by Chrys Wu, The New York Times
Inspecting the inspectors: Using inspection data to drive your stories;Michael Pell, Joce Sterman;Salon BC;Saturday;2 p.m. - 2:50 p.m.;
Getting started with Python;Anthony DeBarros;Stadium 3;Saturday;2 p.m. - 2:50 p.m.;
Regular expressions;Amanda Hickman;Stadium 5;Saturday;2 p.m. - 2:50 p.m.;
"&quot;Mind the Gap&quot; --- Holes in your data can lead you to stories";Thomas Hargrove, Jennifer LaFleur;Salon DEF;Saturday;2 p.m. - 2:50 p.m.;
Mini Boot Camp - Saturday;TBA;See printed schedule for room information;Saturday;2 p.m. - 4:50 p.m.;Kickstart your data skills with IRE's original mini-boot camp. This series of hands-on classes will introduce you to spreadsheets and databases with IRE's proven techniques.
Inside the global offshore money maze;David Donald, Mar Cabra, Margot Williams;Grand Ballroom West;Saturday;2 p.m. - 2:50 p.m.;
OpenElections year-in-review;Sara Schnadt, Serdar Tumgoren, Derek Willis;Chesapeake;Saturday;2 p.m. - 2:50 p.m.;The core team from the OpenElections Project will show their progress on the Knight-funded effort to gather and standardize election data from across the country. Learn what data is already available, how you can contribute, and share ideas on how the project can best help journalists prepare for the 2014 mid-term elections.
Advanced GitHubbing and Git Internals;Ben Balter, Jordan McCullough;Salon A;Saturday;2 p.m. - 2:50 p.m.;
Unlocking secrets of Excel to cover economics and business;Aaron Kessler;Stadium 4;Saturday;2 p.m. - 2:50 p.m.;
Creating maps: Principles, mistakes and potential;Tom MacWright, Noah Veltman;Grand Ballroom East;Saturday;2 p.m. - 2:50 p.m.;
Open data: Practical tips and current issues;Waldo Jaquith, Julia Keseru, Denise Malan;Grand Ballroom West;Saturday;3 p.m. - 3:50 p.m.;
"You won&#39;t believe what static site generators can do for news apps";Jeremy Bowers, Tyler Fisher, David Eads;Chesapeake;Saturday;3 p.m. - 3:50 p.m.;
Data deep dives (part 1);TBA;Salon DEF;Saturday;3 p.m. - 3:50 p.m.;
Python: Beyond the basics I;Serdar Tumgoren, Jeremy Bowers;Stadium 3;Saturday;3 p.m. - 3:50 p.m.;
Beyond the basics: Advanced SQL for analysis;James Gordon, Liz Lucas;Stadium 4;Saturday;3 p.m. - 3:50 p.m.;If you feel comfortable with the Structured Query Language basics that IRE teaches in its boot camps -- SELECT, FROM, WHERE, GROUP BY -- but are ready to see what else SQL can do, this session is for you. We will cover more advanced ways of manipulating and questioning data, such as UPDATE queries, different types of joins, writing sub-queries, merging results from two queries, and other neat tricks. Some of this SQL is too advanced for Microsoft Access, so we will use MySQL in the class.
Crossing the language boundaries across your newsroom: journo to dev and back;Sarah Cohen, Erika Owens, Noah Veltman;Grand Ballroom East;Saturday;3 p.m. - 3:50 p.m.;
Getting data into Excel;Jeffrey Kelly Lowenstein;Salon A;Saturday;3 p.m. - 3:50 p.m.;
CAR wash: Clean that dirty data;David Herzog;Salon A;Saturday;3 p.m. - 3:50 p.m.;
"It&#39;s not on the exam: Exploring data beyond standardized tests on the education beat";Coulter Jones, Meredith Broussard;Salon BC;Saturday;3 p.m. - 3:50 p.m.;A lot happens in and around schools that isn't on those bubble tests. From buildings and books to food and everything else in between, schools are teeming with underutilized data. We'll look at different sources for stories and new ways to dive in to data on education beat.
The latest from Sunlight;Bill Allison;Chesapeake;Saturday;4 p.m. - 4:50 p.m.;"Developers and journalists from the Sunlight Foundation offer an in-depth look at tools like Scout, which allows users to track subjects across an array of federal legislative and regulatory information; Ad Hawk, a Shazam-like app for political ads; and RealTimeFEC, which parses campaign finance data on the fly. Learn how they were built and how to use them."
Data deep dives (part 2);TBA;Salon DEF;Saturday;4 p.m. - 4:50 p.m.;
Lyra: Custom visualization design without programming;Arvind Satyanarayan;Salon A;Saturday;4 p.m. - 4:50 p.m.;"Lyra is an interactive environment that enables custom visualization design without writing any code. Visualizations are built by composing graphical ""marks"" such as rectangles, arcs, lines, and text. These marks can be bound to data fields using property drop zones; dynamically positioned using connectors; and directly moved, rotated, and resized using handles. Lyra also provides a data pipeline interface for iterative visual specification of data transformations and layout algorithms. Lyra is more expressive than interactive systems like Tableau, allowing designers to create custom visualizations comparable to hand-coded visualizations created using D3 or Processing. These visualizations can then be easily published and reused on the Web."
Python: Beyond the basics II;Serdar Tumgoren, Jeremy Bowers;Stadium 3;Saturday;4 p.m. - 4:50 p.m.;
Even more with R;Bill Alpert;Stadium 4;Saturday;4 p.m. - 4:50 p.m.;
Make your dirty data shine with Open Refine (repeat);Roberto Rocha;Stadium 5;Saturday;4 p.m. - 4:50 p.m.;
CAR Conference Sales (Sunday);TBA;University Ballroom;Sunday;8:30 a.m. - 10:30 a.m.;"Stop by the IRE sales table and take a look at our merchandise. We will be selling books, the large selection of titles we carry will certainly include your interests. The winner of the IRE T-shirt contest will be displayed and on sale.&nbsp;"
Tools for Social Network Analysis investigations;Joe Germuska, Miranda Mulligan;Salon BC;Sunday;9 a.m. - 11:50 a.m.;Join the team from Northwestern U. Knight Lab for a practical, participatory session that will help you incorporate design thinking methodologies into building tools for social network analysis investigations. Plus, help design and develop ideas for new tools while learning more about the Lab's Untangled project. This workshop is designed for beginners and will introduce some intermediate terminology. All welcome: writers, researchers, editors, designers, developers, educators, etc.
Where do you want to go: Career roundtable;Anthony DeBarros, Ellen Gabler, Sisi Wei, Mark Horvit, Lea Thompson;Grand Ballroom East;Sunday;9 a.m. - 9:50 a.m.;**Moderated by Mark Horvit, IRE/NICAR
Installation party;TBA;Stadium 5;Sunday;9 a.m. - 10:50 a.m.;"Many conference sessions cover tools and applications that are open source and available to journalists for free. During this extended session we invite you to bring your laptop and we'll help you get set up with the tools you've heard about and are itching to try out. We will rely on volunteers to help out, so what you're able to &nbsp;install and how long it takes will depend on demand. Remember also that you must have administrative privileges on your machine; if you're blocked from these privileges, we won't be able to override that."
Mini Boot Camp - Sunday;TBA;See printed schedule for room information;Sunday;9 a.m. - 11:50 a.m.;Kickstart your data skills with IRE's original mini-boot camp. This series of hands-on classes will introduce you to spreadsheets and databases with IRE's proven techniques.
Census I: Must-have data for every beat;Paul Overberg, Ronald Campbell, Mike Maciag;Grand Ballroom West;Sunday;9 a.m. - 9:50 a.m.;Census data spawns its own stories, but it's also the denominator on every beat. Learn the annual schedule and what kind of stories -- breaking and enterprise -- you can do with each release. Hear a reporter explain his own stories. We'll also do '20 in 20':Use 20 minutes to review at least 20 stories done by local journalists like you.
Advanced searching techniques;Acton Gorton;Salon DEF;Sunday;9 a.m. - 9:50 a.m.;"Learn to apply a systematic approach to finding specific information using the Google and Lexis-Nexis. The workshop will include an overview of key concepts and a walk-through of an audience volunteered search. The overview will cover basics of word stemming, word truncation, word proximity, wildcards, controlled vocabularies and free-text methodologies. The walk-through will demonstrate Google's ""Fuzzy"" search options, in addition to using Lexis-Nexis for newspaper and document retrieval."
OpenElections hackathon;TBA;Chesapeake;Sunday;10 a.m. - 6 p.m.;
A tour of IRE and NICAR (Make the most of your membership);TBA;Salon DEF;Sunday;10 a.m. - 10:50 a.m.;
Census II: Going beyond the basics;Paul Overberg, Ronald Campbell;Grand Ballroom West;Sunday;10 a.m. - 10:50 a.m.;"Be prepared to say &ldquo;I didn&rsquo;t know you could do that&rdquo; as we explore more advanced census data and tools. Learn how microdata is the secret sauce that lets you create a custom recipe of census data. Tour the growing ecosystem of tools and data around the American Community Survey. And learn how to do some new tricks, like how to count adult children living with their parents in your town."
Build your bot army;Joe Kokenge, Brian Abelson, Abraham Epton;Salon DEF;Sunday;10 a.m. - 10:50 a.m.;
"Feel like you&#39;re hacking without really doing it";Samantha Sunne;Salon DEF;Sunday;11 a.m. - 11:50 a.m.;
Census III: Mapping and presentation;John Keefe, Chris Amico;Grand Ballroom West;Sunday;11 a.m. - 11:50 a.m.;
