Title;Speaker;Place;Day;Time;Description
TechRaking 5ish: Bootstrapping the news (Sponsored by The Center for Investigative Reporting);Agustin Armendariz, Michael Corey, Aaron Williams;Chesapeake;Wednesday;1 p.m. - 5 p.m.;Emcees: Agustin Armendariz, Michael Corey, Aaron Williams
CAR Conference Registration (Wednesday);TBA;University Ballroom;Wednesday;2 p.m. - 5 p.m.;Registration will be located on the 1st floor of the Baltimore Marriott Inner Harbor in University Ballroom.
Detecting corporate fraud (Sponsored by Donald W. Reynolds National Center for Business Journalism);Roddy Boyd, Theo Francis;Salon DEF;Wednesday;2 p.m. - 5 p.m.;"The Donald W. Reynolds National Center for Business Journalism will offer a free pre-conference workshop from 2-5 p.m. on Wednesday, Feb. 26. In this free workshop, journalists will learn techniques for digging &ndash; with an eye for fraud &ndash; into U.S. Securities and Exchange Commission filings and other disclosures. Instead of spending weeks scouring aimlessly through hundreds of pages of corporate documents, reporters will gain an understanding of what key financial information is available, where to look in the documents to quickly identify trouble spots and how to recognize when crucial details are missing."
CAR Conference Sales (Thursday);TBA;University Ballroom;Thursday;7:30 a.m. - 5 p.m.;"Stop by the IRE sales table and take a look at our merchandise. We will be selling books, the large selection of titles we carry will certainly include your interests. The winner of the IRE T-shirt contest will be displayed and on sale.&nbsp;"
CAR Conference Registration (Thursday);TBA;University Ballroom;Thursday;7:30 a.m. - 5 p.m.;Registration will be located on the 1st floor of the Baltimore Marriott Inner Harbor in University Ballroom.
Welcome and overview of the conference;Jaimi Dowdell, Mark Horvit, Megan Luther;Grand Ballroom West;Thursday;8:30 a.m. - 8:50 a.m.;
Tableau Public for beginners (Hosted by Tableau);Jewel Loree;Stadium 1;Thursday;9 a.m. - 12:30 p.m.;Learn how to create beautiful, interactive data visualizations on short deadlines. No programming required. You'll learn everything you need to build data visualizations and publish them to your website just like a video. We'll teach you how to: Connect to Excel files and other data, create maps and charts, format them beautifully and make them interactive.
NewsCamp::The next generation of data viz;Alberto Cairo;Grand Ballroom East;Thursday;9 a.m. - 9:50 a.m.;
Getting started with open-source database manager MySQL;TBA;Stadium 3;Thursday;9 a.m. - 9:50 a.m.;
PyCAR Mini Boot Camp;Heather Billings, Tom Meagher, Eric Sagara;See printed schedule for room information;Thursday;9 a.m. - 4:50 p.m.;Introduction to Python
Mapping Mini Boot Camp;Jennifer LaFleur, David Herzog, Robby Deming, Clem Henriksen, Brian Peterson;Stadium 2;Thursday;9 a.m. - 4:50 p.m.;Learn how to uncover interesting news stories by mapping data with geographic information system (GIS) software during our intensive mini-boot camp and receive a free copy of ArcGIS Desktop*.
Media as data, illuminating the undiscovered country of television news;Roger Macdonald;Chesapeake;Thursday;9 a.m. - 9:50 a.m.;
Controlling CAR conference overload;Megan Luther, Tisha Thompson;Grand Ballroom West;Thursday;9 a.m. - 9:50 p.m.;
Amazon Cloud Basics;Scott Klein;Stadium 4;Thursday;9 a.m. - 9:50 a.m.;Cloud servers are an amazingly flexible way to use computing resources. Servers and test benches used to take weeks to order and configure, but thanks to the cloud, you can build up arbitrarily complex farms of computers to do your bidding in a few minutes, from serving a dynamic news app to crunching through a data set to trying out a new technology on the cheap. This course will help you understand the thicket of acronyms and programs that make up Amazon's AWS system and will get you started building servers.
Make dirty data shine with OpenRefine;Frederick Kaimann;Stadium 4;Thursday;10 a.m. - 10:50 a.m.;
Use FOIA Machine to prepare, send and track your public records requests;Michael Corey, Coulter Jones, Djordje Padejski, Shane Shifflett, Steven Melendez;Chesapeake;Thursday;10 a.m. - 10:50 a.m.;
Getting started with open-source database manager MySQL Part II;TBA;Stadium 3;Thursday;10 a.m. - 10:50 a.m.;
Enhance your stories with statistics;Rob Barry, Steven Rich;Salon DEF;Thursday;10 a.m. - 10:50 a.m.;
NewsCamp::Intro to D3;Irene Ros, Arvind Satyanarayan, Alastair Dant;Grand Ballroom East;Thursday;10 a.m. - 11:50 a.m.;
Follow the fracking;Tom McGinty, Mike Soraghan;Salon BC;Thursday;10 a.m. - 10:50 a.m.;
The data-driven story (Part 1) Conceiving and launching;David Donald, Jennifer LaFleur, Brant Houston;Grand Ballroom West;Thursday;10 a.m. - 10:50 a.m.;**Moderated by Brant Houston, University of Illinois
Torturing Excel into doing stats;Steve Doig;Stadium 4;Thursday;11 a.m. - 11:50 a.m.;
Maps and charts in R: real newsroom examples;Matthew Waite;Stadium 3;Thursday;11 a.m. - 11:50 a.m.;
The data-driven story (Part 2) Putting the package together;Brant Houston, Maud Beelman,;Grand Ballroom West;Thursday;11 a.m. - 11:50 a.m.;
FollowTheMoney: Lead the pack in tracking campaign finance;Edwin Bender;Chesapeake;Thursday;11 a.m. - 11:50 a.m.;Take your political reporting to higher levels with FTM's new and expanded website. Learn insider tips on how to add ingenious features and expanded data to your reporting toolkit.
Love your life, retire your servers;Andy Boyle, Tasneem Raja;Salon DEF;Thursday;11 a.m. - 11:50 a.m.;"Building news applications is hard. Running dozens of servers&mdash;or even one&mdash;can be even harder. Save your sanity: build everything as a &ldquo;static&rdquo; project instead. We&rsquo;ll show you the pros and cons of getting rid of most of your pesky servers, tell you what you&rsquo;ll need instead, and show you how static apps can make your life easier and even help you work with the rest of your newsroom."
Tableau Public for pros (Hosted by Tableau);Mike Klaczynski;Stadium 1;Thursday;1:30 p.m. - 5:30 p.m.;Take your data visualization skills to the next level. In this class we'll push Tableau's capabilities further to create more complex visualizations. You'll learn how to: Clean and format dirty data, use multiple data sources in the same visualization, build more advanced visualizations and employ advanced interactive elements.
"The customized Census: How to use microdata when you just can&#39;t find the right table";Robert Gebeloff, Katie Genadek;Chesapeake;Thursday;2 p.m. - 2:50 p.m.;So you want to use Census data but you can't find a Census table that has exactly what you want. Or you want to create a time series, and you're not sure if this year's table is comparable with past years. Census microdata, and the folks at IPUMS, are here to help. Learn how this free and useful resource for developing customized tables from the Decennial Census, American Community Survey and the Current Population Survey has produced stories that couldn't be told with published data alone.
NewsCamp: The next generation of data viz (Advanced);Irene Ros, Alastair Dant;See printed schedule for room information;Thursday;2 p.m. - 4:50 p.m.;Advanced Class
The data-driven story (Part 3): Bulletproofing and presentation;Brant Houston, Matt Stiles;Grand Ballroom West;Thursday;2 p.m. - 2:50 p.m.;
How to uncover inequity and swindlers in subsidized housing programs near you;Angela Caputo, Tim Henderson;Salon BC;Thursday;2 p.m. - 2:50 p.m.;
NewsCamp: The next generation of data viz (Beginner);Arvind Satyanarayan;Stadium 4;Thursday;2 p.m. - 4:50 p.m.;Beginner Class
Docs! Docs! Docs!;Ted Han, Shane Shifflett, Jonathan Stray, Mike Tigas, Tyler Dukes;Grand Ballroom East;Thursday;3 p.m. - 3:50 p.m.;"&nbsp;**Moderated by Tyler Dukes, WRAL-Raleigh"
Make reporting better, together — Collaborative reporting with GitHub;Ben Balter, Jordan McCullough;Chesapeake;Thursday;3 p.m. - 3:50 p.m.;
"When data don&#39;t exist";Sarah Cohen, Meghan Hoyer, Matthew Waite;Salon DEF;Thursday;3 p.m. - 3:50 p.m.;
Save the data: going from zip (drive) to news by rescuing, analyzing old data;Cheryl Phillips, Derek Willis;Grand Ballroom West;Thursday;3 p.m. - 3:50 p.m.;Come help explore the possibilities and cautions in saving, rescuing and reviving old data sets as well as aggregating and standardizing disparate local data to create a bigger impact. Possible hackfest to follow.
Breaking out the heavy artillery - using data to track weapons;David Fallis, Griff Palmer;Salon BC;Thursday;3 p.m. - 3:50 p.m.;
Harnessing the power of the crowd;Robert Benincasa, Mohammed Haddad;Salon DEF;Thursday;4 p.m. - 4:50 p.m.;
Investigating infrastructure: The National Inventory of Dams;Liz Lucas, Joe Davis;Salon BC;Thursday;4 p.m. - 4:50 p.m.;
How the internet watches you;Nat Meysenburg, Dan Staples;Grand Ballroom East;Thursday;4 p.m. - 4:50 p.m.;Privacy is not dead. Surveillance is not inevitable. But if we ever want to keep our data from the snoops and thieves, or work to keep sources and contacts safe, we first need to understand how the internet works. In this visual presentation, Technologists from the Open Technology Institute explain the basics of what happens when you send an email or connect to a WiFi hotspot, and how criminals and governments (or criminal governments) can intercept and monitor that data.
Tools for cracking PDFs;Edward Duncan, Jeremy Merrill, Mark Horvit;Grand Ballroom West;Thursday;4 p.m. - 4:50 p.m.;**Moderated by Mark Horvit, IRE/NICAR
The Investigative Dashboard – Tools to expose organized crime and corruption around the world.;Margot Williams;Chesapeake;Thursday;4 p.m. - 4:50 p.m.;"Your stories are international - your research should be too. That vital piece of evidence might be in another country, in another language, in a database you have never heard of before. The Investigative Dashboard helps you find it, both with databases and with personal help from skilled researchers. Come demo the Investigative Dashboard, a research tool of the Organized Crime and Corruption Reporting Project developed in collaboration with Google Ideas. &nbsp;"
CAR Conference Sales (Friday);TBA;University Ballroom;Friday;8 a.m. - 5 p.m.;"Stop by the IRE sales table and take a look at our merchandise. We will be selling books, the large selection of titles we carry will certainly include your interests. The winner of the IRE T-shirt contest will be displayed and on sale.&nbsp;"
CAR Conference Registration (Friday);TBA;University Ballroom;Friday;8 a.m. - 5 p.m.;Registration will be located on the 1st floor of the Baltimore Marriott Inner Harbor in University Ballroom.
Fusion Tables for beginners;Daniel Lathrop;Stadium 4;Friday;9 a.m. - 9:50 a.m.;
A tour of the new Census Reporter;Joe Germuska, Sara Schnadt;Chesapeake;Friday;9 a.m. - 9:50 a.m.;"Census Reporter is a new, free and powerful tool made by journalists to help journalists use census data in their stories. Building on it&rsquo;s predecessor, census.IRE.org, which made Census data more easily available for download, this new project has developed an interface to help a wide range of journalists from shoe-leather types to journo nerds and app developers get the census data they need to give context to their stories, and also dig deeper to explore and analyze census data in new ways. This site tour will introduce the depth and potential use cases for this data set while showing off some of the new tools created to let you learn more about your beat, make meaningful comparisons across topics, populations and geographies, and expose patterns in hyper local, regional and national cultural/social/economic landscapes."
Rifling through the mapping toolbox;Ryan McNeill, Michael Corey;Salon BC;Friday;9 a.m. - 9:50 a.m.;There are many powerful spatial tools at a journalist's disposal. What's the right tool for the job? We'll use real-world examples of the process of transforming a pile of data into a compelling story and visual presentation using a wide variety of tools: ArcGIS, QGIS, PostGIS, TileMill, GDAL, GeoDjango and probably a few more acronyms for good measure.
Holding algorithms accountable;Nicholas Diakopoulos, Jeremy Singer-Vine, Chase Davis, Frank Pasquale;Grand Ballroom West;Friday;9 a.m. - 9:50 a.m.;**Moderated by Chase Davis, The New York Times
Getting started with Excel;Helena Bengtsson;Stadium 1;Friday;9 a.m. - 9:50 a.m.;
Statistics: an introduction;Ronald Campbell;Stadium 2;Friday;9 a.m. - 9:50 a.m.;
The year in CAR in odorama;Jaimi Dowdell, Mark Horvit, Jennifer LaFleur;Grand Ballroom East;Friday;9 a.m. - 9:50 a.m.;**Jennifer LaFleur, Odor Master
Finding great stories in not-so-great nonprofits;Luke Rosiak, Kendall Taggart;Salon DEF;Friday;9 a.m. - 9:50 a.m.;
Intro to JavaScript;Jeff Larson;Salon A;Friday;9 a.m. - 9:50 a.m.;
Build your first News App (Friday);Chase Davis, Ben Welsh, Derek Willis;Stadium 3;Friday;9 a.m. - 11:50 a.m.;This mini-boot camp will walk you through the process of building a simple, useful online news application from a dataset. You will get hands-on experience in every stage of the development process, writing Python, HTML and JavaScript using version control tools. You won't stop until you've deployed a working application onto the World Wide Web. If you have a good attitude and know how to take a few code crashes in stride, you are qualified for this class.
Advanced functions in Excel;Steve Doig;Stadium 5;Friday;9 a.m. - 9:50 a.m.;
Using formulas in Excel;Ryann Grochowski Jones;Stadium 1;Friday;10 a.m. - 10:50 a.m.;
Powerful data science tools without an engineering degree;Matthew Granade;Chesapeake;Friday;10 a.m. - 10:50 a.m.;"Increasingly, data analysts are filling their need for powerful tools by turning to products and services designed for IT professionals. Whether they need access to the cloud to crush large data sets, or flexible version control to manage complicated projects, analysts are forced to waste time struggling with tools that are difficult to setup and configure for anyone who isn't an engineer. That's where Domino comes in: Domino is a platform for data scientists working in R, Python and Matlab who want powerful tools that ""just work"" without any setup. Domino lets you run your analysis in cloud without changing your code; provides automatic version control for your data, code, and results; and facilitates collaboration on your projects. In this talk, Matthew will demo Domino and talk about how other data journalists are using it in their day-to-day work."
Liberate data from PDFs with Tabula;Mike Tigas, Jeremy Merrill;Stadium 5;Friday;10 a.m. - 10:50 a.m.;Ever receive a FOIA response that has all the data you want -- but in PDF files? Ever try accessing that data in Excel or database software?
Complaints: A road map for killer investigations;Tisha Thompson, Jill Riepenhoff;Salon DEF;Friday;10 a.m. - 10:50 a.m.;
Introduction to R;Sharon Machlis;Salon A;Friday;10 a.m. - 10:50 a.m.;
Free the data: Getting government agencies to give up the goods;Kirsten Mitchell, Michael Ravnitzky, Kate Willson, Deborah Nelson;Grand Ballroom West;Friday;10 a.m. - 10:50 a.m.;**Moderated by Deborah Nelson, University of Maryland
Wading through the sea of data on hospitals, doctors, medicine and more;Dan Keating, Charles Ornstein, Peter Eisler;Salon BC;Friday;10 a.m. - 10:50 a.m.;
Web scraping - yes we can;Tommy Kaas, Nils Mulvad;Stadium 4;Friday;10 a.m. - 10:50 a.m.;
Proper workflows for data projects;TBA;Grand Ballroom East;Friday;10 a.m. - 10:50 a.m.;
Statistics: basic linear regression;David Donald;Stadium 2;Friday;10 a.m. - 10:50 a.m.;
Pivot tables for stories;Jonathan Stoneman;Stadium 1;Friday;11 a.m. - 11:50 a.m.;
PoliInformatics research challenge : New methods for computational investigations of the financial crisis;Anne Washington;Chesapeake;Friday;11 a.m. - 11:50 a.m.;
Analyze networks with NodeXL;Peter Aldhous;Stadium 4;Friday;11 a.m. - 11:50 a.m.;
Campaign Finance I: Mining FEC data;Aaron Bycoffe, Jack Gillum, Chris Schnaars;Salon DEF;Friday;11 a.m. - 11:50 a.m.;
NewsCamp::Demystifying D3;Alastair Dant, Irene Ros,;Grand Ballroom East;Friday;11 a.m. - 11:50 a.m.;
Statistics: logistic regression;Jennifer LaFleur;Stadium 2;Friday;11 a.m. - 11:50 a.m.;
Mapping from the desktop to the web;Robby Deming, Brian Peterson, Clem Henriksen;Salon A;Friday;11 a.m. - 11:50 a.m.;
Git and GitHub 101 — Create your first pull request today!;Ben Balter, Jordan McCullough;Stadium 5;Friday;11 a.m. - 11:50 a.m.;
Cooking with hardware;John Keefe, Liza Stark;Grand Ballroom West;Friday;11 a.m. - 11:50 a.m.;Liza and John will demonstrate (and share recipes for) dozens of hardware projects they've built over the last year, from conductive dough and blinky lights to cicada-tracking temperature sensors. Come explore how physical computing might be a part of your next project or feature.
Student brown bag: What do you mean I can’t have that public record?;Jill Riepenhoff, Tyler Dukes, Adam Goldstein;Salon BC;Friday;12:30 p.m. - 1:30 p.m.;"Grab your lunch before this session starts. &nbsp;Beverages and dessert will be provided."
Building charts and graphs that are connected to live data;Timothy Barmann;Chesapeake;Friday;2 p.m. - 2:50 p.m.;
Building maps with leaflet and mapbox.js;Becca Aaronson;Stadium 3;Friday;2 p.m. - 2:50 p.m.;
Intro To SQLite;Troy Thibodeaux;Stadium 4;Friday;2 p.m. - 2:50 p.m.;
Create your own interactive newsgame in 50 minutes!;Sisi Wei;Salon A;Friday;2 p.m. - 2:50 p.m.;
Investigating racial inequality;Nikole Hannah-Jones, Steve Doig, Lawrence Lanahan;Salon BC;Friday;2 p.m. - 2:50 p.m.;**Moderated by Steve Doig, Arizona State University
Protecting your work from prying eyes;Susan McGregor, Jennifer Valentino-DeVries, Josh Meyer, Lindsay Beck;Grand Ballroom East;Friday;2 p.m. - 2:50 p.m.;**Moderated by Josh Meyer, Medill National Security Journalism Initiative
Mini Boot Camp;TBA;See printed schedule for room information;Friday;2 p.m. - 3:50 p.m.;Kickstart your data skills with IRE's original mini-boot camp. This series of hands-on classes will introduce you to spreadsheets and databases with IRE's proven techniques.
Campaign Finance II: Going beyond the data;Jack Gillum, Chris Schnaars, Fredreka Schouten;Salon DEF;Friday;2 p.m. - 2:50 p.m.;
The customized Census: Using microdata;Robert Gebeloff, Katie Genadek;Stadium 5;Friday;2 p.m. - 2:50 p.m.;Working with microdata sounds scary but it's not. In this hands-on workshop, attendees will gain experience using IPUMS census data via the online analysis system, SDA. We will guide users through the process from the research question to data access and analysis. Our goal is to help users improve their reporting on the American population through thoughtful use of IPUMS data. Participants in this workshop should have attended our previous session or have a working understanding of microdata. All attendees should register in advance for IPUMS-USA (free and easy!) at https://usa.ipums.org/usa-action/users/login.
Social media for investigations;Mandy Jenkins, Robert Hernandez;Grand Ballroom West;Friday;2 p.m. - 2:50 p.m.;
100+ tips and tools for news research;Margot Williams, Gary Price;Grand Ballroom East;Friday;3 p.m. - 3:50 p.m.;Nicarians will leave with a basket of tips and tools for public records research, online privacy, advanced search techniques, alerting services and personal web caching and archiving.
DataViz for everyone: A practical guide to going responsive;Lena Groeger, Ryan Pitts, Chris Amico;Grand Ballroom West;Friday;3 p.m. - 3:50 p.m.;
Using Excel for statistics;Krista Kjellman Schmidt;Stadium 5;Friday;3 p.m. - 3:50 p.m.;
SQLite for command line;Matt Kiefer;Stadium 4;Friday;3 p.m. - 3:50 p.m.;
Everyday scripting;Agustin Armendariz;Stadium 3;Friday;3 p.m. - 3:50 p.m.;
Grabbing data from websites: tips and tricks;Michelle Minkoff, Scott Klein;Salon A;Friday;3 p.m. - 3:50 p.m.;
50 ideas in 50 minutes;Jodi Upton, MaryJo Webster;Salon DEF;Friday;3 p.m. - 3:50 p.m.;
How PANDA works: Software architecture for big data;Brian Boyer, Christopher Groskopf;Chesapeake;Friday;3 p.m. - 3:50 p.m.;
Lightning talks (Sponsored by John S. and James L. Knight Foundation);Derek Willis;Grand Ballroom East;Friday;4:15 p.m. - 5:30 p.m.;**Moderated by Derek Willis, The New York Times
Philip Meyer Award Reception;TBA;University Ballroom;Friday;5:30 p.m. - 6:45 p.m.;"Join fellow CAR attendees for the presentation of the Philip Meyer Journalism Awards at a reception Friday night with light hor d' oeuvres and a cash bar beginning at 5:30 p.m. in University Ballroom. &nbsp;"
CAR Conference Sales (Saturday);TBA;University Ballroom;Saturday;8:30 a.m. - 5 p.m.;"Stop by the IRE sales table and take a look at our merchandise. We will be selling books, the large selection of titles we carry will certainly include your interests. The winner of the IRE T-shirt contest will be displayed and on sale.&nbsp;"
CAR Conference Registration (Saturday);TBA;University Ballroom;Saturday;8:30 a.m. - 5 p.m.;Registration will be located on the 1st floor of the Baltimore Marriott Inner Harbor in University Ballroom.
My friend FRED: A free tool for searching and graphing business, economic and government data;Keith Taylor;Stadium 5;Saturday;9 a.m. - 9:50 a.m.;Get hands-on training on FRED, a free data toolkit for journalists. You'll learn how to quickly find and download any of 156,000 series of local, U.S. and international data from 61 sources, and then easily place that data into interactive graphs for print or web use.
Introduction to mapping: Importing and displaying data geographically with QGIS;Peter Aldhous;Stadium 1;Saturday;9 a.m. - 9:50 a.m.;
Incorporating data into your beat;Tom McGinty, Ron Nixon;Salon DEF;Saturday;9 a.m. - 9:50 a.m.;
Ruby 1: Introduction;Al Shaw;Salon A;Saturday;9 a.m. - 9:50 a.m.;
"How to feel like you&#39;re hacking without really doing it";Samantha Sunne;Stadium 4;Saturday;9 a.m. - 9:50 a.m.;
Threat modeling: Security for your story;Jonathan Stray;Grand Ballroom East;Saturday;9 a.m. - 9:50 a.m.;
Getting started with SQL;Fred Vallance-Jones;Stadium 2;Saturday;9 a.m. - 9:50 a.m.;
Build your first News App (Saturday);Chase Davis, Ben Welsh, Derek Willis;Stadium 3;Saturday;9 a.m. - 11:50 a.m.;This mini-boot camp will walk you through the process of building a simple, useful online news application from a dataset. You will get hands-on experience in every stage of the development process, writing Python, HTML and JavaScript using version control tools. You won't stop until you've deployed a working application onto the World Wide Web. If you have a good attitude and know how to take a few code crashes in stride, you are qualified for this class.
Politcial framing: Computational analysis of rhetoric in large text datasets;Al Johri, Dhrumil Mehta;Chesapeake;Saturday;9 a.m. - 9:50 a.m.;This session will introduce Political framing, a project aimed at allowing you to more meaningfully analyze large natural language datasets using computational methods. In our project, we analyze the congressional record to computationally understand how politicians frame their rhetoric around particular issues by using machine learning to recognize patterns in their speech and observe how these patterns change over time. We envision expanding these methods to any large text dataset and are excited to have a discussion about all of the possibilities that this and other new kinds of text analysis algorithms can unlock for journalism.
The art and craft of finding people;Julie Tate, Rick Yarborough;Grand Ballroom West;Saturday;9 a.m. - 9:50 a.m.;
Danger! Hazardous materials: Using data to uncover pollution;Denise Malan, Ben Poston, Tim Wheeler;Salon BC;Saturday;9 a.m. - 9:50 a.m.;
Mapping 2: Manipulating and editing geographic data with QGIS;Peter Aldhous;Stadium 1;Saturday;10 a.m. - 10:50 a.m.;
DocumentCloud;Ted Han, Mark Horvit;Stadium 4;Saturday;10 a.m. - 10:50 a.m.;
Counting and summing with SQL;Andrea Fuller;Stadium 2;Saturday;10 a.m. - 10:50 a.m.;
Building a data journalism course;Cheryl Phillips, Amanda Hickman, Fred Vallance-Jones, Ira Chinoy;Salon BC;Saturday;10 a.m. - 10:50 a.m.;**Moderated by Fred Vallance-Jones, University of King's College
docHive: Pulling structured data from scanned PDFs;Charles Duncan, Edward Duncan;Stadium 5;Saturday;10 a.m. - 10:50 a.m.;
A quick trip through data in the sciences;Beth Duckles, Cynthia Hsu, Sarah Cohen;Grand Ballroom East;Saturday;10 a.m. - 10:50 a.m.;**Moderated by Sarah Cohen, The New York Times
An app for that: Mobile tech and tools for reporting;David Ho;Grand Ballroom West;Saturday;10 a.m. - 10:50 a.m.;The mobile revolution is upon us, but how can the technology help you as a journalist? Bring your toolbox into the age of smart phones and tablets with this session on apps for gathering and producing news. Record an interview? Transcribe a speech? Archive Tweets? Track an airplane? There's an app for that. Plus learn other mobile tips, tricks and tools to supercharge your reporting.
Journalists - Staying safe in a digital world;Kelley Misata;Chesapeake;Saturday;10 a.m. - 10:50 a.m.;Governments, criminal networks, and private companies are using technology to track journalists and their sources. This session will cover what communication networks and third party services know about you, how to protect your communications from various adversaries, and how to safely store data.
Ruby 2: Acquiring and transforming data;Jeff Larson;Salon A;Saturday;10 a.m. - 10:50 a.m.;
Excel magic: Advanced functions in Excel;MaryJo Webster;Stadium 1;Saturday;11 a.m. - 11:50 a.m.;
Go! Go! In the hot seat with breaking news;Jaimi Dowdell, Megan Luther;Stadium 5;Saturday;11 a.m. - 11:50 a.m.;
