Topic,Subject,Start Date,Start Time,End Date,End Time,All Day Event,Description,Location,Private
,Techraking &lt;=10: Bootstrapping the News (Sponsored by The Center for Investigative Reporting),2015-03-04,1:00:00 p.m.,2015-03-04,5:00:00 p.m.,False,"Speakers TBA - Give us four hours and your laptop, and we&rsquo;ll send you into NICAR with a fully-functioning data-crunching machine and the knowledge to use it.",International 10,False
,Secrets of Covering Money (Sponsored by the Donald W. Reynolds National Center for Business Journalism),2015-03-04,2:00:00 p.m.,2015-03-04,5:00:00 p.m.,False,"Speakers: Brandon Quester - Money is in every story, from education to politics to metro, sports and entertainment. Learn how to explore the money across many beats in this pre-conference Reynolds Center workshop led by Brandon Quester.&nbsp;",International 8-9,False
,Welcome and overview of the conference,2015-03-05,8:30 a.m.,2015-03-05,8:50 a.m.,False,"Speakers: Jaimi Dowdell, Alex Richards, Megan Luther, Mark Horvit",International 8-9,False
python,PyCAR,2015-03-05,9:00:00 a.m.,2015-03-05,5:30 p.m.,False,"Speakers TBA - Introduction to Python. This hands-on workshop will teach journalists basic programming concepts using the Python language. The daylong class will introduce language basics and useful libraries in the course of a typical reporting project: scraping data from the Web, inserting it in a database and analyzing the results.",See printed schedule for room information,False
,Getting started: Intro to CAR and the conference,2015-03-05,9:00:00 a.m.,2015-03-05,10:00:00 a.m.,False,"Speakers: Megan Luther, Ron Nixon, Jill Riepenhoff",International 8-9,False
tableau,Interactive data graphics in Tableau Public (Hosted by Tableau),2015-03-05,9:00:00 a.m.,2015-03-05,10:30 a.m.,False,"Speakers: Ben Jones - Learn how to create beautiful, interactive data visualizations on short deadlines. No programming required. You'll learn everything you need to build data visualizations and publish them to your website just like a video.&nbsp;",M101,False
python,Intermediate Python,2015-03-05,9:00:00 a.m.,2015-03-05,5:30 p.m.,False,"Speakers: Jeremy Bowers, Serdar Tumgoren - You've written a few Python scripts that get the job done, but the initial euphoria has worn off. Your code is hard to understand. Bugs are cropping up. Worse, you can't always explain your process or results to an editor -- or yourself. There must be a better way, but the path forward is not clear. If you've had that itchy feeling, this daylong, hands-on workshop is for you.",M102,False
,Map Camp (pre-registered attendees only),2015-03-05,9:00:00 a.m.,2015-03-05,5:30 p.m.,False,"Speakers: David Herzog, Jennifer LaFleur, Robby Deming, Brian Peterson - Learn how to uncover interesting news stories by mapping data with geographic information system (GIS) software during our intensive mini-boot camp and receive a free copy of ArcGIS Desktop*.",M109,False
,Investigating business with data,2015-03-05,9:00:00 a.m.,2015-03-05,10:00:00 a.m.,False,Speakers TBA,International 2-3,False
,From words to pictures: Text analysis and visualization,2015-03-05,9:00:00 a.m.,2015-03-05,10:00:00 a.m.,False,Speakers: Nicholas Diakopoulos,International 10,False
,Twitter tricks and analytics,2015-03-05,9:00:00 a.m.,2015-03-05,10:00:00 a.m.,False,Speakers TBA,M107,False
spreadsheets,Excel magic (advanced functions),2015-03-05,9:00:00 a.m.,2015-03-05,10:00:00 a.m.,False,Speakers: ,M105,False
databases,Getting started with open-source database manager MySQL,2015-03-05,9:00:00 a.m.,2015-03-05,10:00:00 a.m.,False,Speakers: T. Christian Miller,M103,False
,Spotlight: Being a reporter when everyone&#39;s a journalist and there&#39;s data everywhere,2015-03-05,9:00:00 a.m.,2015-03-05,10:00:00 a.m.,False,Speakers: Zeynep Tufekci,International 6-7,False
,Do it once (and only once),2015-03-05,10:10 a.m.,2015-03-05,11:10 a.m.,False,Speakers: Derek Willis,International 6-7,False
,Designing database applications to increase page views and ad revenues,2015-03-05,10:10 a.m.,2015-03-05,11:10 a.m.,False,"Speakers: Edward Garcia - With journalists facing increasing pressure to create data interactives that engage more readers, it&rsquo;s important to optimize data-driven applications for interactivity, traffic and page views. Learn how to design and deploy revenue-generating applications that will continue to serve as long-lasting data assets. This demo will showcase real-world examples and techniques for building &ldquo;share-worthy&rdquo; hyper-local applications. Technologies covered: Caspio, Google maps, Google charts, GPS and location proximity, AJAX, CDN, data feeds, SEO, and cross-channel deployment (web, mobile and social).",M107,False
web development,"Interactives without programming: A new tool for building data-driven, interactive content",2015-03-05,10:10 a.m.,2015-03-05,11:10 a.m.,False,Speakers: Ted Benson,International 10,False
spreadsheets,Excel for business and economics,2015-03-05,10:10 a.m.,2015-03-05,11:10 a.m.,False,Speakers: Aaron Kessler,M103,False
,What the hell is R and all the other questions you’re afraid to ask,2015-03-05,10:10 a.m.,2015-03-05,11:10 a.m.,False,"Speakers: Sisi Wei, Tisha Thompson",International 8-9,False
,Tracking diseases,2015-03-05,10:10 a.m.,2015-03-05,11:10 a.m.,False,"Speakers: Gary Baum, Daniel Lathrop, Betsy McKay",International 4-5,False
,The forgotten history of data journalism,2015-03-05,10:10 a.m.,2015-03-05,11:10 a.m.,False,Speakers: Scott Klein,International 2-3,False
,Make Photoshop work for you,2015-03-05,10:10 a.m.,2015-03-05,11:10 a.m.,False,Speakers: Christopher Canipe,M105,False
tableau,Advanced design and interaction in Tableau Public (Hosted by Tableau Public),2015-03-05,11:00:00 a.m.,2015-03-05,12:30 p.m.,False,"Speakers: Jewel Loree, - Analyzing data and coming up interactive visualizations is easy in Tableau but sometimes getting everything looking polished isn&rsquo;t. In this session you will learn how to break away from the default formatting in Tableau Public to create interactive data graphics that match your style guides and engage your readers.&nbsp;",M101,False
,Tell stories about your community with real estate data,2015-03-05,11:20 a.m.,2015-03-05,12:20 p.m.,False,Speakers: Skylar Olsen,International 10,False
,First steps with R,2015-03-05,11:20 a.m.,2015-03-05,12:20 p.m.,False,Speakers TBA,M107,False
,Spotlight: A conversation with Hanna Wallach - lessons from computational social sciences,2015-03-05,11:20 a.m.,2015-03-05,12:20 p.m.,False,"Speakers: Sarah Cohen - **Moderated by Sarah Cohen, The New York Times",International 8-9,False
,Uncovering racial and economic divides using data,2015-03-05,11:20 a.m.,2015-03-05,12:20 p.m.,False,Speakers TBA,International 2-3,False
,Digging deeper with the Web,2015-03-05,11:20 a.m.,2015-03-05,12:20 p.m.,False,Speakers: Mark Horvit,International 6-7,False
,Data from scratch: When data don&#39;t exist,2015-03-05,11:20 a.m.,2015-03-05,12:20 p.m.,False,"Speakers: Ricardo Brom, Griff Palmer, Lisa Pickoff-White",International 4-5,False
spreadsheets,OpenRefine,2015-03-05,11:20 a.m.,2015-03-05,12:20 p.m.,False,Speakers: Frederick Kaimann,M103,False
spreadsheets,Getting started with Access,2015-03-05,11:20 a.m.,2015-03-05,12:20 p.m.,False,Speakers: Pam Dempsey,M105,False
tableau,Intro to data stories in Tableau Public (Hosted by Tableau Public),2015-03-05,1:30 p.m.,2015-03-05,3:00:00 p.m.,False,"Speakers: Andrew Cheung - Got a dataset and an impending deadline to write a story on it? Find the scoop and convey it with beautiful, interactive visualizations in a serial narrative using Tableau Public. It&rsquo;s a fast, easy to use, and free tool for journalists. Visualizations will publish using any CMS and no programming is required.&nbsp;",M101,False
,Make every international story a data story,2015-03-05,2:10 p.m.,2015-03-05,3:20 p.m.,False,"Speakers: Eva Constantaras, Giannina Segnini",International 4-5,False
,CAR on the beat,2015-03-05,2:10 p.m.,2015-03-05,3:10 p.m.,False,"Speakers: Kate Martin, Christopher Weaver, Jennifer Smith Richards - *Moderated by Jennifer Smith Richards, The Columbus Dispatch",International 2-3,False
web development,"Plotly: Making &amp; sharing beautiful, engaging graphs",2015-03-05,2:10 p.m.,2015-03-05,3:10 p.m.,False,Speakers: Matthew Sundquist,International 10,False
,The latest on open records,2015-03-05,2:10 p.m.,2015-03-05,3:10 p.m.,False,"Speakers: Michael Morisy - *Moderated by Kathleen Johnston, independent journalist",International 8-9,False
spreadsheets,Counting and summing with Access,2015-03-05,2:10 p.m.,2015-03-05,3:10 p.m.,False,Speakers: Andrea Fuller,M105,False
statistics,Stats: An introduction,2015-03-05,2:10 p.m.,2015-03-05,3:10 p.m.,False,Speakers: Jeff Kelly Lowenstein,M103,False
,Space journalism: Using satellite imagery for data projects,2015-03-05,2:10 p.m.,2015-03-05,3:10 p.m.,False,"Speakers: Brian Jacobs, Lela Prashad, Derek Watkins",International 6-7,False
,Import.io: Web scraping without coding,2015-03-05,3:20 p.m.,2015-03-05,4:20 p.m.,False,Speakers: Andrew Fogg,M107,False
,Analyzing jobs in your community,2015-03-05,3:20 p.m.,2015-03-05,4:20 p.m.,False,"Speakers: Tyler Dukes, MaryJo Webster",International 2-3,False
,"I screwed up. I survived and you can, too.",2015-03-05,3:20 p.m.,2015-03-05,4:20 p.m.,False,"Speakers: Sarah Cohen, Tom McGinty, Coulter Jones - *Moderated by Coulter Jones, MedPage Today",International 4-5,False
,Humanizing numbers,2015-03-05,3:20 p.m.,2015-03-05,4:20 p.m.,False,Speakers TBA,International 6-7,False
,VR for the NICAR world: Immersive data,2015-03-05,3:20 p.m.,2015-03-05,4:20 p.m.,False,Speakers TBA,International 8-9,False
,Bedfellows: Explore the relationships between PAC donors and recipients,2015-03-05,3:20 p.m.,2015-03-05,4:20 p.m.,False,Speakers: Derek Willis,International 10,False
spreadsheets,Joining tables with Access,2015-03-05,3:20 p.m.,2015-03-05,4:20 p.m.,False,Speakers: Michael Pell,M105,False
statistics,Stats: Basic linear regression,2015-03-05,3:20 p.m.,2015-03-05,4:20 p.m.,False,Speakers: Holly Hacker,M103,False
tableau,Advanced calculations and analysis in Tableau Public (Hosted by Tableau Public),2015-03-05,3:30 p.m.,2015-03-05,5:00:00 p.m.,False,Speakers: Tara Walker - Learn how to use Tableau to dive deeper into your data and ask powerful questions. We&rsquo;ll be starting with a &ldquo;messy&rdquo; dataset and learn how to explore trends that would normally be difficult to see without further analysis and calculations.&nbsp;,M101,False
,Deep dives part 1,2015-03-05,4:30 p.m.,2015-03-05,5:30 p.m.,False,Speakers TBA,International 6-7,False
,Testing security in your community,2015-03-05,4:30 p.m.,2015-03-05,5:30 p.m.,False,Speakers: Espen Sandli,International 10,False
,"Broadcast: Viz, quick hits and the data you need",2015-03-05,4:30 p.m.,2015-03-05,5:30 p.m.,False,"Speakers: Jamie Grey, Andy Pierrotti, Tisha Thompson, Matt Goldberg - *Moderated by Matt Goldberg, KNBC-Los Angeles",International 8-9,False
javascript,"Building better maps with Leaflet, Mapbox and Javascript",2015-03-05,4:30 p.m.,2015-03-05,5:30 p.m.,False,Speakers: Ashlyn Still,M07,False
statistics,Stats: Logistic regression,2015-03-05,4:30 p.m.,2015-03-05,5:30 p.m.,False,Speakers: David Donald,M103,False
command line,Make the command line work for you,2015-03-05,4:30 p.m.,2015-03-05,5:30 p.m.,False,Speakers: Liz Lucas,M105,False
,Tell me a story I won&#39;t forget,2015-03-05,4:30 p.m.,2015-03-05,5:30 p.m.,False,Speakers TBA,International 2-3,False
,Teaching data journalism: Your best ideas,2015-03-05,4:30 p.m.,2015-03-05,5:30 p.m.,False,"Speakers: Brant Houston, MaryJo Webster - *Moderated by Brant Houston, University of Illinois and MaryJo Webster, USA TODAY",International 4-5,False
regex,Regular expressions for beginners,2015-03-06,9:00:00 a.m.,2015-03-06,10:00:00 a.m.,False,Speakers: Abraham Hyatt,M105,False
command line,Useful command line tools for reporters,2015-03-06,9:00:00 a.m.,2015-03-06,10:00:00 a.m.,False,Speakers: Matt Kiefer,M107,False
python,Build your first news app *pre-registered attendees only,2015-03-06,9:00:00 a.m.,2015-03-06,12:20 p.m.,False,"Speakers: Ben Welsh, Derek Willis - This mini-boot camp will walk you through the process of building a simple, useful online news application from a dataset. You will get hands-on experience in every stage of the development process, writing Python, HTML and JavaScript using version control tools. You won't stop until you've deployed a working application onto the World Wide Web. Preregistration is required and seating is limited. Sessions will be held on Friday and Saturday morning. Laptops will be provided for the training.",M102,False
,Bridging the developer/journalist gap,2015-03-06,9:00:00 a.m.,2015-03-06,10:00:00 a.m.,False,"Speakers: Anthony DeBarros, Maureen Linke, Chrys Wu",International 8-9,False
,The new ecosystem of health care data,2015-03-06,9:00:00 a.m.,2015-03-06,10:00:00 a.m.,False,Speakers: Dan Keating,International 2-3,False
,Data journalism in the university: Making the paradigm shift,2015-03-06,9:00:00 a.m.,2015-03-06,10:00:00 a.m.,False,"Speakers: Meredith Broussard, Matthew Waite, Brant Houston - *Moderated by Brant Houston, University of Illinois",International 4-5,False
,The year in CAR,2015-03-06,9:00:00 a.m.,2015-03-06,10:00:00 a.m.,False,"Speakers: Megan Luther, Alex Richards",International 6-7,False
web development,Github 101: The basics,2015-03-06,9:00:00 a.m.,2015-03-06,10:00:00 a.m.,False,"Speakers: Jessica Lord, Anna Wiener",M101,False
,Amazon cloud basics,2015-03-06,9:00:00 a.m.,2015-03-06,10:00:00 a.m.,False,Speakers: Scott Klein,M109,False
,Making timelines,2015-03-06,9:00:00 a.m.,2015-03-06,10:00:00 a.m.,False,Speakers: Lena Groeger,M104,False
,Moonshining: Indexes pack high-proof explanatory power,2015-03-06,9:00:00 a.m.,2015-03-06,10:00:00 a.m.,False,Speakers: Paul Overberg,International 10,False
maps,Fusion Tables for beginners,2015-03-06,9:00:00 a.m.,2015-03-06,10:00:00 a.m.,False,Speakers: Kate Martin,M106,False
spreadsheets,Getting started in Excel,2015-03-06,9:00:00 a.m.,2015-03-06,10:00:00 a.m.,False,Speakers: Helena Bengtsson,M103,False
command line,How I learned to take command of the command line: A journalist&#39;s guide to getting started,2015-03-06,10:10 a.m.,2015-03-06,11:10 a.m.,False,"Speakers: Chris Keller, AJ Vicens",M101,False
,Map like a pro with ArcGIS Online,2015-03-06,10:10 a.m.,2015-03-06,11:10 a.m.,False,"Speakers: Robby Deming, Brian Peterson",M104,False
spreadsheets,Using formulas in Excel,2015-03-06,10:10 a.m.,2015-03-06,11:10 a.m.,False,Speakers: John Schoen,M103,False
,Crowdsourcing with Google Forms,2015-03-06,10:10 a.m.,2015-03-06,11:10 a.m.,False,Speakers: Doug Haddix,M109,False
python,Getting started with Python,2015-03-06,10:10 a.m.,2015-03-06,11:10 a.m.,False,Speakers TBA,M107,False
,Data alchemy,2015-03-06,10:10 a.m.,2015-03-06,11:10 a.m.,False,"Speakers: Mike Tigas, Jeremy Merrill",M105,False
,First steps with R (repeat session),2015-03-06,10:10 a.m.,2015-03-06,11:10 a.m.,False,Speakers: Annie Waldman,M106,False
,Introducing Geomancer: Don’t let your data be lonely tonight,2015-03-06,10:10 a.m.,2015-03-06,11:10 a.m.,False,"Speakers: Derek Eder, Troy Thibodeaux",International 10,False
,Red alert: Tools to automatically generate story leads,2015-03-06,10:10 a.m.,2015-03-06,11:10 a.m.,False,"Speakers: Abe Handler, Thomas Thoren",International 8-9,False
,Watchdogging public spending,2015-03-06,10:10 a.m.,2015-03-06,11:10 a.m.,False,Speakers TBA,International 6-7,False
,Thinking about interactivity,2015-03-06,10:10 a.m.,2015-03-06,11:10 a.m.,False,Speakers TBA,International 4-5,False
,Visual journalism for tiny news desks,2015-03-06,10:10 a.m.,2015-03-06,11:10 a.m.,False,"Speakers: Kaeti Hinck, Jaeah Lee, Aaron Williams",International 2-3,False
"statistics, spreadsheets",Simple stats in Excel,2015-03-06,11:20 a.m.,2015-03-06,12:20 p.m.,False,Speakers: Olga Pierce,M105,False
,Tools for cracking PDFs,2015-03-06,11:20 a.m.,2015-03-06,12:20 p.m.,False,"Speakers: Miguel Barbosa, Kevin Crowe",International 10,False
,Jobs and career straight-talk: For (and by) young&#39;uns only,2015-03-06,11:20 a.m.,2015-03-06,12:20 p.m.,False,"Speakers: Jeremy Merrill, Sisi Wei",International 8-9,False
,Machine learning in the wild -- #wins and #fails,2015-03-06,11:20 a.m.,2015-03-06,12:20 p.m.,False,"Speakers: Sarah Cohen, Steven Rich, Janet Roberts",International 6-7,False
,Local data that can lead to stories,2015-03-06,11:20 a.m.,2015-03-06,12:20 p.m.,False,Speakers TBA,International 4-5,False
,Color (and shape and plance) my world,2015-03-06,11:20 a.m.,2015-03-06,12:20 p.m.,False,Speakers TBA,International 2-3,False
web development,Github 101: The basics (repeat session),2015-03-06,11:20 a.m.,2015-03-06,12:20 p.m.,False,"Speakers: Jessica Lord, Anna Wiener",M107,False
spreadsheets,PivotTables in Excel,2015-03-06,11:20 a.m.,2015-03-06,12:20 p.m.,False,Speakers: Jonathan Stoneman,M103,False
,Visualizing your data with R,2015-03-06,11:20 a.m.,2015-03-06,12:20 p.m.,False,Speakers: Ronald Campbell,M106,False
web development,Introduction to web programming,2015-03-06,11:20 a.m.,2015-03-06,12:20 p.m.,False,Speakers: Peggy Bustamante,M104,False
python,Web scraping using Python,2015-03-06,11:20 a.m.,2015-03-06,12:20 p.m.,False,Speakers: Paul Schreiber,M101,False
,"Critical questions to ask of studies, press releases and scientific reports",2015-03-06,2:10 p.m.,2015-03-06,3:10 p.m.,False,"Speakers: Peter Aldhous, Ronald Campbell",International 4-5,False
,Stat-a-thon,2015-03-06,2:10 p.m.,2015-03-06,3:10 p.m.,False,"Speakers: Agustin Armendariz, David Donald, Holly Hacker, Dan Keating, Sharon Machlis, Jennifer LaFleur - *Moderated by Jennifer LaFleur, The Center for Investigative Reporting",International 6-7,False
,Mini Boot Camp *pre-registered attendees only,2015-03-06,2:10 p.m.,2015-03-06,4:20 p.m.,False,"Speakers: Megan Luther, Jaimi Dowdell - Kickstart your data skills with IRE's original mini-boot camp. &nbsp;This series of hands-on classes will introduce you to spreadsheets and databases with IRE's proven techniques. IRE's experienced trainers will walk you through sorting, calculating and interviewing data. &nbsp;You'll come away with a solid base for using data analysis in your own newsroom.",M103/M105,False
spreadsheets,Life after Excel and Access - the next steps in data journalism,2015-03-06,2:10 p.m.,2015-03-06,3:10 p.m.,False,"Speakers: Helena Bengtsson, Ryann Grochowski Jones",International 8-9,False
,"Scraping, APIs and data extraction",2015-03-06,2:10 p.m.,2015-03-06,3:10 p.m.,False,"Speakers: Cedric Sam, Nils Mulvad",International 10,False
javascript,Getting started with JavaScript,2015-03-06,2:10 p.m.,2015-03-06,3:10 p.m.,False,Speakers: Andy Boyle,M109,False
,Teach yourself to code,2015-03-06,2:10 p.m.,2015-03-06,3:10 p.m.,False,Speakers: Becca Aaronson,M102,False
python,Advanced Django for data analysis,2015-03-06,2:10 p.m.,2015-03-06,3:10 p.m.,False,"Speakers: Armand Emamdjomeh, Anthony Pesce",M101,False
,Mapbox,2015-03-06,2:10 p.m.,2015-03-06,3:10 p.m.,False,Speakers: Sarah Frostenson,M104,False
,Grabbing data from websites without scraping,2015-03-06,2:10 p.m.,2015-03-06,3:10 p.m.,False,"Speakers: Scott Klein, Michelle Minkoff",M109,False
spreadsheets,Getting data into Excel,2015-03-06,2:10 p.m.,2015-03-06,3:10 p.m.,False,Speakers: Patti DiVincenzo,M106,False
,Using data to detect environmental dangers,2015-03-06,2:10 p.m.,2015-03-06,3:10 p.m.,False,"Speakers: Caelainn Barr, Michael Corey",International 2-3,False
javascript,Intro to D3,2015-03-06,2:10 p.m.,2015-03-06,3:10 p.m.,False,Speakers TBA,M107,False
,Data behind the news,2015-03-06,3:20 p.m.,2015-03-06,4:20 p.m.,False,Speakers TBA,International 4-5,False
,Free tools,2015-03-06,3:20 p.m.,2015-03-06,4:20 p.m.,False,"Speakers: Alex Richards, Marco Tulio Pires",International 6-7,False
,Analyzing networks with Gephi,2015-03-06,3:20 p.m.,2015-03-06,4:20 p.m.,False,Speakers: Peter Aldhous,M106,False
,Mapping JS: Building narrative with geo data + CartoDB,2015-03-06,3:20 p.m.,2015-03-06,4:20 p.m.,False,Speakers: Aurelia Moser,M109,False
"command line, web development",GitHub 201: Leveling up with the command line,2015-03-06,3:20 p.m.,2015-03-06,4:20 p.m.,False,"Speakers: Jessica Lord, Anna Wiener",M102,False
,Spotlight: Using abstraction to gain knowledge from numbers,2015-03-06,3:20 p.m.,2015-03-06,4:20 p.m.,False,Speakers TBA,International 8-9,False
,Playing with Arduino,2015-03-06,3:20 p.m.,2015-03-06,4:20 p.m.,False,Speakers: John Keefe,M107,False
command line,Useful command line tools for reporters (repeat),2015-03-06,3:20 p.m.,2015-03-06,4:20 p.m.,False,"Speakers: Agustin Armendariz, Kendall Taggart",M101,False
,Risk assessment basics,2015-03-06,3:20 p.m.,2015-03-06,4:20 p.m.,False,Speakers: Olga Pierce,International 10,False
,Deep dives part 2,2015-03-06,3:20 p.m.,2015-03-06,4:20 p.m.,False,Speakers TBA,International 2-3,False
,Lightning Talks (Sponsored by the Knight Foundation),2015-03-06,4:30 p.m.,2015-03-06,5:45 p.m.,False,"Speakers: Sisi Wei - *Moderated by Sisi Wei, ProPublica",Marquis A-B,False
,Philip Meyer Award Reception,2015-03-06,5:45 p.m.,2015-03-06,7:00:00 p.m.,False,Speakers TBA - Join fellow CAR attendees in celebrating the Philip Meyer Award Winners at a reception Friday night with light hor d' oeuvres and a cash bar beginning at 5:45 p.m. in Marquis Ballroom C-D.&nbsp;,Marquis C-D,False
,"Processes, standards and documentations for data-driven projects",2015-03-07,9:00:00 a.m.,2015-03-07,10:00:00 a.m.,False,"Speakers: Christopher Groskopf, Paul Overberg",International 4-5,False
ruby,Ruby 1: Introduction,2015-03-07,9:00:00 a.m.,2015-03-07,10:00:00 a.m.,False,Speakers: Al Shaw,See printed schedule for room information,False
maps,Advanced Fusion Tables,2015-03-07,9:00:00 a.m.,2015-03-07,10:00:00 a.m.,False,Speakers: Daniel Lathrop,M104,False
,Do more in R with these useful new packages,2015-03-07,9:00:00 a.m.,2015-03-07,10:00:00 a.m.,False,Speakers: Sharon Machlis,M106,False
"databases, command line",More MySQL: Learn to use the command line and other powerful features,2015-03-07,9:00:00 a.m.,2015-03-07,10:00:00 a.m.,False,Speakers: Agustin Armendariz,M105,False
,Create your own interactive newsgame without coding,2015-03-07,9:00:00 a.m.,2015-03-07,10:00:00 a.m.,False,Speakers TBA,M107,False
spreadsheets,Excel magic (advanced functions) *repeat session,2015-03-07,9:00:00 a.m.,2015-03-07,10:00:00 a.m.,False,Speakers: MaryJo Webster,M103,False
python,Build your first news app (Saturday) *pre-registered attendees only,2015-03-07,9:00:00 a.m.,2015-03-07,12:20 p.m.,False,"Speakers: Ben Welsh, Derek Willis - This is a continuation of Friday's hands-on workshop. &nbsp;Preregistered attendees only.",M102,False
,Twitter tricks and analytics (repeat session),2015-03-07,9:00:00 a.m.,2015-03-07,10:00:00 a.m.,False,Speakers: Doug Haddix,M109,False
,Defense against the dark arts: Security for you and your sources,2015-03-07,9:00:00 a.m.,2015-03-07,10:00:00 a.m.,False,Speakers TBA,International 10,False
,Getting it the rightest you can,2015-03-07,9:00:00 a.m.,2015-03-07,10:00:00 a.m.,False,"Speakers: Sarah Cohen, Jennifer LaFleur - *Moderated by Jennifer LaFleur, The Center for Investigative Reporting",International 8-9,False
,"Design/Viz: What to do, and what not to do",2015-03-07,9:00:00 a.m.,2015-03-07,10:00:00 a.m.,False,"Speakers: Anna Flagg, Lena Groeger",International 6-7,False
,Breaking news,2015-03-07,9:00:00 a.m.,2015-03-07,10:00:00 a.m.,False,Speakers: Stephen Stock,International 2-3,False
ruby,Ruby 2: Acquiring and transforming data,2015-03-07,10:10 a.m.,2015-03-07,11:10 a.m.,False,Speakers: Jeff Larson,See printed schedule for room information,False
,R: Preplication,2015-03-07,10:10 a.m.,2015-03-07,11:10 a.m.,False,Speakers: Bill Alpert,M106,False
python,Advanced Python for data analysis: Part 1,2015-03-07,10:10 a.m.,2015-03-07,11:10 a.m.,False,Speakers: ,M104,False
,Municipal bonds 101,2015-03-07,10:10 a.m.,2015-03-07,11:10 a.m.,False,"Speakers: Joel Thurtell, Cezary Podkul",M107,False
databases,Advanced SQL for analysis,2015-03-07,10:10 a.m.,2015-03-07,11:10 a.m.,False,Speakers: Liz Lucas,M105,False
,Managing data teams,2015-03-07,10:10 a.m.,2015-03-07,11:10 a.m.,False,"Speakers: Becca Aaronson, Lauren Rabaino, Adam Schweigert, Trei Brundrett - *Moderated by Trei Brundrett, Vox Media",International 4-5,False
,Tools for cracking PDFs (hands-on),2015-03-07,10:10 a.m.,2015-03-07,11:10 a.m.,False,Speakers: Danielle Cervantes,M109,False
,(Keep) following the money on state and local politics,2015-03-07,10:10 a.m.,2015-03-07,11:10 a.m.,False,"Speakers: Benjamin Wieder, Denise Malan - *Moderated by Benjamin Wieder, The Center for Public Integrity",International 6-7,False
,Social media sleuthing,2015-03-07,10:10 a.m.,2015-03-07,11:10 a.m.,False,Speakers: Doug Haddix,International 8-9,False
web development,Building mobile-ready visualizations and maps in minutes with Silk,2015-03-07,10:10 a.m.,2015-03-07,11:10 a.m.,False,Speakers: Alex Salkever,International 10,False
regex,Text editing with Regular Expressions,2015-03-07,10:10 a.m.,2015-03-07,11:10 a.m.,False,Speakers: Jon McClure,M103,False
,Sensor journalism: Buzz or BS?,2015-03-07,10:10 a.m.,2015-03-07,11:10 a.m.,False,Speakers TBA,International 2-3,False
,Amazon cloud basics (repeat session),2015-03-07,11:20 a.m.,2015-03-07,12:20 p.m.,False,Speakers: Mike Tigas,M105,False
,Intermediate/Advanced Security,2015-03-07,11:20 a.m.,2015-03-07,12:20 p.m.,False,"Speakers: Harlo Holmes, Aurelia Moser",International 10,False
,Policing the police,2015-03-07,11:20 a.m.,2015-03-07,12:20 p.m.,False,"Speakers: Rob Barry, Ben Poston, Topher Sanders - *Moderated by Corey Johnson, The Marshall Project",International 8-9,False
