Topic,Subject,Start Date,Start Time,End Date,End Time,All Day Event,Description,Location,Private
web development,Github 101: The basics,2015-03-06,9:00:00 a.m.,2015-03-06,10:00:00 a.m.,False,"Speakers: Jessica Lord, Anna Wiener - GitHub is the best place to share code with friends, co-workers, classmates, and complete strangers. At its core, GitHub is a source-code host, but the platform can be used for sharing and collaborating on anything from government data to prose. | URL: http://ire.org/events-and-training/event/1494/1622/",M101,False
,Visual journalism for tiny news desks,2015-03-06,10:10 a.m.,2015-03-06,11:10 a.m.,False,"Speakers: Kaeti Hinck, Jaeah Lee, Aaron Williams | URL: http://ire.org/events-and-training/event/1494/1732/",International 2-3,False
,Data alchemy,2015-03-06,10:10 a.m.,2015-03-06,11:10 a.m.,False,"Speakers: Mike Tigas, Jeremy Merrill - Ever get a load of PDF files back when you wanted data? Ever download shapefiles in esoteric projections? Encoding issues? This hands-on workshop will teach data-savvy users how they can get usable, analyzable data out of what would otherwise be considered junk (or a headache). | URL: http://ire.org/events-and-training/event/1494/1794/",M105,False
,Thinking about interactivity,2015-03-06,10:10 a.m.,2015-03-06,11:10 a.m.,False,"Speakers: Mariana Santos, Robert Hernandez - *Moderated by Robert Hernandez, University of Southern California-Annenberg | URL: http://ire.org/events-and-training/event/1494/1733/",International 4-5,False
,Making timelines,2015-03-06,10:10 a.m.,2015-03-06,11:10 a.m.,False,"Speakers: Lena Groeger - Displaying a series of events can be as simple as drawing a straight line. But if you want to get fancier, there are a bunch of other options to display chronologies and storylines. In this talk, we'll take a tour of current timelines in the wild and walk you through three open-source tools to help you make your own: ProPublica's TimelineSetter, Zach Wise's TimelineJS, and WNYC's Vertical Timeline. | URL: http://ire.org/events-and-training/event/1494/1628/",M104,False
spreadsheets,Using formulas in Excel,2015-03-06,10:10 a.m.,2015-03-06,11:10 a.m.,False,Speakers: John Schoen | URL: http://ire.org/events-and-training/event/1494/1635/,M103,False
command line,How I learned to take command of the command line: A journalist&#39;s guide to getting started,2015-03-06,10:10 a.m.,2015-03-06,11:10 a.m.,False,"Speakers: Chris Keller, AJ Vicens - This hands-on session aims to help command line novices learn some basic commands that can help them every day, including navigating through directories, creating files and tools to look at and work with structured data. If you're familiar with grep and curl this will likely be review. We'll end by highlighting some command line libraries that are musts for reporters. and provide additional resources so participants can go deeper on their own. | URL: http://ire.org/events-and-training/event/1494/1623/",M101,False
,Red alert: Tools to automatically generate story leads,2015-03-06,10:10 a.m.,2015-03-06,11:10 a.m.,False,"Speakers: Abe Handler, Thomas Thoren - We'll give you ideas how to use technology to automatically check court records, financial filings, property sales, government contracts, news feeds and other websites for news. We will show off several easy-to-use tools, like Google Alerts and RSS readers, to monitor news feeds. And we'll talk about how to write your own custom programs to check records and generate story leads. | URL: http://ire.org/events-and-training/event/1494/1735/",International 8-9,False
,Watchdogging public spending,2015-03-06,10:10 a.m.,2015-03-06,11:10 a.m.,False,"Speakers: Joanna Lin, Mike Maciag, Cezary Podkul, Nicole Vap - *Moderated by Nicole Vap, KUSA/9News Denver | URL: http://ire.org/events-and-training/event/1494/1734/",International 6-7,False
,First steps with R (repeat session),2015-03-06,10:10 a.m.,2015-03-06,11:10 a.m.,False,"Speakers: Annie Waldman - Take your first steps with powerful, open-source statistical language R by learning some of the basic skills you need to get up and running with R. By the end of this session, you will be able to take raw data, import it into R, and start your analysis. Topics that will be covered include: basic data importing, working with directories, reading in data, installing packages, as well as how to clean, explore and sort data. We'll also talk about how to find help when you're stuck. | URL: http://ire.org/events-and-training/event/1494/1632/",M106,False
,Crowdsourcing with Google Forms,2015-03-06,10:10 a.m.,2015-03-06,11:10 a.m.,False,Speakers: Doug Haddix | URL: http://ire.org/events-and-training/event/1494/1626/,M109,False
python,Getting started with Python,2015-03-06,10:10 a.m.,2015-03-06,11:10 a.m.,False,Speakers: TBA | URL: http://ire.org/events-and-training/event/1494/1795/,M107,False
,Introducing Geomancer: Don’t let your data be lonely tonight,2015-03-06,10:10 a.m.,2015-03-06,11:10 a.m.,False,"Speakers: Derek Eder, Troy Thibodeaux | URL: http://ire.org/events-and-training/event/1494/1736/",International 10,False
,Local data that can lead to stories,2015-03-06,11:20 a.m.,2015-03-06,12:20 p.m.,False,"Speakers: Walker Moskop, Lee Zurik | URL: http://ire.org/events-and-training/event/1494/1738/",International 4-5,False
,Demo: Tools for cracking PDFs,2015-03-06,11:20 a.m.,2015-03-06,12:20 p.m.,False,"Speakers: Miguel Barbosa, Kevin Crowe | URL: http://ire.org/events-and-training/event/1494/1741/",International 10,False
,Color (and shape and plance) my world,2015-03-06,11:20 a.m.,2015-03-06,12:20 p.m.,False,Speakers: TBA | URL: http://ire.org/events-and-training/event/1494/1737/,International 2-3,False
,Machine learning in the wild -- #wins and #fails,2015-03-06,11:20 a.m.,2015-03-06,12:20 p.m.,False,"Speakers: Sarah Cohen, Steven Rich, Janet Roberts | URL: http://ire.org/events-and-training/event/1494/1739/",International 6-7,False
,Jobs and career straight-talk: For (and by) young&#39;uns only,2015-03-06,11:20 a.m.,2015-03-06,12:20 p.m.,False,"Speakers: Jeremy Merrill, Sisi Wei | URL: http://ire.org/events-and-training/event/1494/1740/",International 8-9,False
python,Web scraping using Python,2015-03-06,11:20 a.m.,2015-03-06,12:20 p.m.,False,Speakers: Paul Schreiber | URL: http://ire.org/events-and-training/event/1494/1624/,M101,False
web development,Introduction to web programming,2015-03-06,11:20 a.m.,2015-03-06,12:20 p.m.,False,Speakers: Peggy Bustamante | URL: http://ire.org/events-and-training/event/1494/1630/,M104,False
,Visualizing your data with R,2015-03-06,11:20 a.m.,2015-03-06,12:20 p.m.,False,Speakers: Ronald Campbell | URL: http://ire.org/events-and-training/event/1494/1633/,M106,False
spreadsheets,PivotTables in Excel,2015-03-06,11:20 a.m.,2015-03-06,12:20 p.m.,False,Speakers: Jonathan Stoneman | URL: http://ire.org/events-and-training/event/1494/1636/,M103,False
"statistics, spreadsheets",Simple stats in Excel,2015-03-06,11:20 a.m.,2015-03-06,12:20 p.m.,False,"Speakers: Olga Pierce - You don't need a special statistics program to run simple statistics. In this session, you'll learn how to compute some basic statistics in Excel and figure out what they mean. | URL: http://ire.org/events-and-training/event/1494/1638/",M105,False
web development,Github 101: The basics (repeat session),2015-03-06,11:20 a.m.,2015-03-06,12:20 p.m.,False,"Speakers: Jessica Lord, Anna Wiener - GitHub is the best place to share code with friends, co-workers, classmates, and complete strangers. At its core, GitHub is a source-code host, but the platform can be used for sharing and collaborating on anything from government data to prose. | URL: http://ire.org/events-and-training/event/1494/1640/",M107,False
spreadsheets,Getting data into Excel,2015-03-06,2:10 p.m.,2015-03-06,3:10 p.m.,False,Speakers: Patti DiVincenzo | URL: http://ire.org/events-and-training/event/1494/1648/,M106,False
,Mini Boot Camp *pre-registered attendees only,2015-03-06,2:10 p.m.,2015-03-06,4:20 p.m.,False,"Speakers: Megan Luther, Jaimi Dowdell - Kickstart your data skills with IRE's original mini-boot camp. &nbsp;This series of hands-on classes will introduce you to spreadsheets and databases with IRE's proven techniques. IRE's experienced trainers will walk you through sorting, calculating and interviewing data. &nbsp;You'll come away with a solid base for using data analysis in your own newsroom. | URL: http://ire.org/events-and-training/event/1494/1603/",M103/M105,False
javascript,Getting started with JavaScript,2015-03-06,2:10 p.m.,2015-03-06,3:10 p.m.,False,"Speakers: Andy Boyle - In this workshop, you'll learn not only basic JavaScript fundamentals, but some larger programming fundamentals, too. You'll learn about variables, if/else logic, functions and more. You'll also learn about JavaScript programming shortcuts using JavaScript libraries, such as jQuery. You'll also be shown examples of projects built using JavaScript, so you'll know what is possible. | URL: http://ire.org/events-and-training/event/1494/1645/",M109,False
,"Scraping, APIs and data extraction",2015-03-06,2:10 p.m.,2015-03-06,3:10 p.m.,False,"Speakers: Cedric Sam, Nils Mulvad | URL: http://ire.org/events-and-training/event/1494/1746/",International 10,False
,Teach yourself to code,2015-03-06,2:10 p.m.,2015-03-06,3:10 p.m.,False,Speakers: Becca Aaronson | URL: http://ire.org/events-and-training/event/1494/1643/,M102,False
javascript,Intro to D3,2015-03-06,2:10 p.m.,2015-03-06,3:10 p.m.,False,Speakers: TBA | URL: http://ire.org/events-and-training/event/1494/1798/,M107,False
,Mapbox,2015-03-06,2:10 p.m.,2015-03-06,3:10 p.m.,False,Speakers: Sarah Frostenson | URL: http://ire.org/events-and-training/event/1494/1796/,M104,False
python,Advanced Django for data analysis,2015-03-06,2:10 p.m.,2015-03-06,3:10 p.m.,False,"Speakers: Armand Emamdjomeh, Anthony Pesce | URL: http://ire.org/events-and-training/event/1494/1641/",M101,False
spreadsheets,Life after Excel and Access - the next steps in data journalism,2015-03-06,2:10 p.m.,2015-03-06,3:10 p.m.,False,"Speakers: Helena Bengtsson, Ryann Grochowski Jones, Eric Sagara - This panel features several data experts from traditional beat reporting backgrounds who will talk about their professional development experiences. What was their next steps after learning the basics of data reporting? How did they discover and learn new tools? How can reporters lobby in their newsrooms for time to learn new tools? | URL: http://ire.org/events-and-training/event/1494/1745/",International 8-9,False
,Grabbing data from websites without scraping,2015-03-06,2:10 p.m.,2015-03-06,3:10 p.m.,False,"Speakers: Scott Klein, Michelle Minkoff | URL: http://ire.org/events-and-training/event/1494/1627/",M109,False
,Using data to detect environmental dangers,2015-03-06,2:10 p.m.,2015-03-06,3:10 p.m.,False,"Speakers: Caelainn Barr, Michael Corey, Robert Gebeloff | URL: http://ire.org/events-and-training/event/1494/1742/",International 2-3,False
,"Critical questions to ask of studies, press releases and scientific reports",2015-03-06,2:10 p.m.,2015-03-06,3:10 p.m.,False,"Speakers: Peter Aldhous, Ronald Campbell, Pat Thomas | URL: http://ire.org/events-and-training/event/1494/1743/",International 4-5,False
,Stat-a-thon,2015-03-06,2:10 p.m.,2015-03-06,3:10 p.m.,False,"Speakers: Agustin Armendariz, David Donald, Holly Hacker, Dan Keating, Sharon Machlis, Jennifer LaFleur - *Moderated by Jennifer LaFleur, The Center for Investigative Reporting | URL: http://ire.org/events-and-training/event/1494/1744/",International 6-7,False
,Free tools,2015-03-06,3:20 p.m.,2015-03-06,4:20 p.m.,False,"Speakers: Alex Richards, Marco Tulio Pires, Natalia Mazotte | URL: http://ire.org/events-and-training/event/1494/1749/",International 6-7,False
,Mapping JS: Building narrative with geo data + CartoDB,2015-03-06,3:20 p.m.,2015-03-06,4:20 p.m.,False,Speakers: Aurelia Moser | URL: http://ire.org/events-and-training/event/1494/1646/,M109,False
,Deep dives part 2,2015-03-06,3:20 p.m.,2015-03-06,4:20 p.m.,False,"Speakers: John Bones - *Moderated by John Bones,&nbsp;Verdens Gang | URL: http://ire.org/events-and-training/event/1494/1747/",International 2-3,False
,Risk assessment basics,2015-03-06,3:20 p.m.,2015-03-06,4:20 p.m.,False,Speakers: Olga Pierce | URL: http://ire.org/events-and-training/event/1494/1751/,International 10,False
,Data behind the news,2015-03-06,3:20 p.m.,2015-03-06,4:20 p.m.,False,Speakers: TBA | URL: http://ire.org/events-and-training/event/1494/1748/,International 4-5,False
command line,Useful command line tools for reporters (repeat),2015-03-06,3:20 p.m.,2015-03-06,4:20 p.m.,False,"Speakers: Agustin Armendariz, Kendall Taggart | URL: http://ire.org/events-and-training/event/1494/1642/",M101,False
,Playing with Arduino,2015-03-06,3:20 p.m.,2015-03-06,4:20 p.m.,False,Speakers: John Keefe | URL: http://ire.org/events-and-training/event/1494/1649/,M107,False
,Spotlight: Using abstraction to gain knowledge from numbers,2015-03-06,3:20 p.m.,2015-03-06,4:20 p.m.,False,Speakers: TBA | URL: http://ire.org/events-and-training/event/1494/1750/,International 8-9,False
"command line, web development",GitHub 201: Leveling up with the command line,2015-03-06,3:20 p.m.,2015-03-06,4:20 p.m.,False,"Speakers: Jessica Lord, Anna Wiener | URL: http://ire.org/events-and-training/event/1494/1644/",M102,False
,Analyzing networks with Gephi,2015-03-06,3:20 p.m.,2015-03-06,4:20 p.m.,False,Speakers: Peter Aldhous | URL: http://ire.org/events-and-training/event/1494/1647/,M106,False
,Lightning Talks (Sponsored by the Knight Foundation),2015-03-06,4:30 p.m.,2015-03-06,5:45 p.m.,False,"Speakers: Sisi Wei - *Moderated by Sisi Wei, ProPublica | URL: http://ire.org/events-and-training/event/1494/1752/",Marquis A-B,False
,Philip Meyer Award Reception,2015-03-06,5:45 p.m.,2015-03-06,7:00:00 p.m.,False,Join fellow CAR attendees in celebrating the Philip Meyer Award Winners at a reception Friday night with light hor d' oeuvres and a cash bar beginning at 5:45 p.m. in Marquis Ballroom C-D.&nbsp; | URL: http://ire.org/events-and-training/event/1494/1753/,Marquis C-D,False
,"Processes, standards and documentations for data-driven projects",2015-03-07,9:00:00 a.m.,2015-03-07,10:00:00 a.m.,False,"Speakers: Christopher Groskopf, Paul Overberg | URL: http://ire.org/events-and-training/event/1494/1755/",International 4-5,False
spreadsheets,Excel magic (advanced functions) *repeat session,2015-03-07,9:00:00 a.m.,2015-03-07,10:00:00 a.m.,False,"Speakers: MaryJo Webster - Learn about various tools and functions in Excel that come in handy when you need to re-structure or otherwise get your data ready for analysis. We'll cover string functions, logical functions, date functions, the Tableau Reshaper, merging data using lookup functions and perhaps a few other nifty tricks if time allows. This is a fast-paced class intended to introduce you to these tools, not master them. But you'll walk out with practice data and a 20-page tipsheet that covers in detail everything we do in class, plus other great Excel tips. | URL: http://ire.org/events-and-training/event/1494/1690/",M103,False
,Twitter tricks and analytics (repeat session),2015-03-07,9:00:00 a.m.,2015-03-07,10:00:00 a.m.,False,Speakers: Doug Haddix | URL: http://ire.org/events-and-training/event/1494/1653/,M109,False
,Defense against the dark arts: Security for you and your sources,2015-03-07,9:00:00 a.m.,2015-03-07,10:00:00 a.m.,False,Speakers: TBA | URL: http://ire.org/events-and-training/event/1494/1758/,International 10,False
,Getting it the rightest you can,2015-03-07,9:00:00 a.m.,2015-03-07,10:00:00 a.m.,False,"Speakers: Sarah Cohen, Jennifer LaFleur - *Moderated by Jennifer LaFleur, The Center for Investigative Reporting | URL: http://ire.org/events-and-training/event/1494/1757/",International 8-9,False
,"Design/Viz: What to do, and what not to do",2015-03-07,9:00:00 a.m.,2015-03-07,10:00:00 a.m.,False,"Speakers: Anna Flagg, Lena Groeger | URL: http://ire.org/events-and-training/event/1494/1756/",International 6-7,False
,Breaking news,2015-03-07,9:00:00 a.m.,2015-03-07,10:00:00 a.m.,False,Speakers: Stephen Stock | URL: http://ire.org/events-and-training/event/1494/1754/,International 2-3,False
python,Build your first news app (Saturday) *pre-registered attendees only,2015-03-07,9:00:00 a.m.,2015-03-07,12:20 p.m.,False,"Speakers: Ben Welsh, Derek Willis - This is a continuation of Friday's hands-on workshop. &nbsp;Preregistered attendees only. | URL: http://ire.org/events-and-training/event/1494/1602/",M102,False
,Create your own interactive newsgame without coding,2015-03-07,9:00:00 a.m.,2015-03-07,10:00:00 a.m.,False,Speakers: TBA | URL: http://ire.org/events-and-training/event/1494/1664/,M107,False
"databases, command line",More MySQL: Learn to use the command line and other powerful features,2015-03-07,9:00:00 a.m.,2015-03-07,10:00:00 a.m.,False,Speakers: Agustin Armendariz | URL: http://ire.org/events-and-training/event/1494/1663/,M105,False
,Do more in R with these useful new packages,2015-03-07,9:00:00 a.m.,2015-03-07,10:00:00 a.m.,False,Speakers: Sharon Machlis | URL: http://ire.org/events-and-training/event/1494/1657/,M106,False
maps,Advanced Fusion Tables,2015-03-07,9:00:00 a.m.,2015-03-07,10:00:00 a.m.,False,Speakers: Daniel Lathrop | URL: http://ire.org/events-and-training/event/1494/1656/,M104,False
ruby,Ruby 1: Introduction,2015-03-07,9:00:00 a.m.,2015-03-07,10:00:00 a.m.,False,Speakers: Al Shaw | URL: http://ire.org/events-and-training/event/1494/1650/,See printed schedule for room information,False
,How to build a happy team,2015-03-07,10:10 a.m.,2015-03-07,11:10 a.m.,False,"Speakers: Becca Aaronson, Lauren Rabaino, Adam Schweigert, Trei Brundrett - *Moderated by Trei Brundrett, Vox Media | URL: http://ire.org/events-and-training/event/1494/1760/",International 4-5,False
,Municipal bonds 101,2015-03-07,10:10 a.m.,2015-03-07,11:10 a.m.,False,"Speakers: Joel Thurtell, Cezary Podkul | URL: http://ire.org/events-and-training/event/1494/1665/",M107,False
databases,Advanced SQL for analysis,2015-03-07,10:10 a.m.,2015-03-07,11:10 a.m.,False,Speakers: Liz Lucas | URL: http://ire.org/events-and-training/event/1494/1662/,M105,False
regex,Text editing with Regular Expressions,2015-03-07,10:10 a.m.,2015-03-07,11:10 a.m.,False,Speakers: Jon McClure | URL: http://ire.org/events-and-training/event/1494/1660/,M103,False
,R: Preplication,2015-03-07,10:10 a.m.,2015-03-07,11:10 a.m.,False,Speakers: Bill Alpert | URL: http://ire.org/events-and-training/event/1494/1658/,M106,False
,Tools for cracking PDFs,2015-03-07,10:10 a.m.,2015-03-07,11:10 a.m.,False,Speakers: Danielle Cervantes | URL: http://ire.org/events-and-training/event/1494/1654/,M109,False
web development,Building mobile-ready visualizations and maps in minutes with Silk,2015-03-07,10:10 a.m.,2015-03-07,11:10 a.m.,False,Speakers: Alex Salkever | URL: http://ire.org/events-and-training/event/1494/1763/,International 10,False
,Social media sleuthing,2015-03-07,10:10 a.m.,2015-03-07,11:10 a.m.,False,Speakers: Doug Haddix | URL: http://ire.org/events-and-training/event/1494/1762/,International 8-9,False
,(Keep) following the money on state and local politics,2015-03-07,10:10 a.m.,2015-03-07,11:10 a.m.,False,"Speakers: Ben Wieder, Denise Malan - *Moderated by Benjamin Wieder, The Center for Public Integrity | URL: http://ire.org/events-and-training/event/1494/1761/",International 6-7,False
,Sensor journalism: Buzz or BS?,2015-03-07,10:10 a.m.,2015-03-07,11:10 a.m.,False,Speakers: TBA | URL: http://ire.org/events-and-training/event/1494/1759/,International 2-3,False
python,Advanced Python for data analysis: Part 1,2015-03-07,10:10 a.m.,2015-03-07,11:10 a.m.,False,Speakers:  | URL: http://ire.org/events-and-training/event/1494/1799/,M104,False
ruby,Ruby 2: Acquiring and transforming data,2015-03-07,10:10 a.m.,2015-03-07,11:10 a.m.,False,Speakers: Jeff Larson | URL: http://ire.org/events-and-training/event/1494/1651/,See printed schedule for room information,False
,Policing the police,2015-03-07,11:20 a.m.,2015-03-07,12:20 p.m.,False,"Speakers: Rob Barry, Ben Poston, Topher Sanders - *Moderated by Corey Johnson, The Marshall Project | URL: http://ire.org/events-and-training/event/1494/1767/",International 8-9,False
,Go home and share your work!,2015-03-07,11:20 a.m.,2015-03-07,12:20 p.m.,False,Speakers: TBA | URL: http://ire.org/events-and-training/event/1494/1765/,International 4-5,False
,Deep dive: Phil Meyer Award winners,2015-03-07,11:20 a.m.,2015-03-07,12:20 p.m.,False,"*Moderated by Mark Horvit, IRE/NICAR | URL: http://ire.org/events-and-training/event/1494/1764/",International 2-3,False
,Machine learning,2015-03-07,11:20 a.m.,2015-03-07,12:20 p.m.,False,Speakers: Chase Davis | URL: http://ire.org/events-and-training/event/1494/1666/,M107,False
spreadsheets,OpenRefine (repeat session),2015-03-07,11:20 a.m.,2015-03-07,12:20 p.m.,False,Speakers: David Herzog | URL: http://ire.org/events-and-training/event/1494/1661/,M103,False
python,Advanced Python for data analysis: Part 2,2015-03-07,11:20 a.m.,2015-03-07,12:20 p.m.,False,Speakers: TBA | URL: http://ire.org/events-and-training/event/1494/1800/,M104,False
,Amazon cloud basics (repeat session),2015-03-07,11:20 a.m.,2015-03-07,12:20 p.m.,False,Speakers: Mike Tigas | URL: http://ire.org/events-and-training/event/1494/1801/,M105,False
,Import.io: Web scraping without coding (repeat session),2015-03-07,11:20 a.m.,2015-03-07,12:20 p.m.,False,Speakers: Andrew Fogg | URL: http://ire.org/events-and-training/event/1494/1691/,M109,False
ruby,Ruby 3: Simple web apps with Ruby,2015-03-07,11:20 a.m.,2015-03-07,12:20 p.m.,False,Speakers: Jacob Harris | URL: http://ire.org/events-and-training/event/1494/1652/,See printed schedule for room information,False
,Under pressure: Real life in real time with breaking news,2015-03-07,11:20 a.m.,2015-03-07,12:20 p.m.,False,Speakers: Stephen Stock | URL: http://ire.org/events-and-training/event/1494/1659/,M106,False
,Intermediate/Advanced Security,2015-03-07,11:20 a.m.,2015-03-07,12:20 p.m.,False,"Speakers: Harlo Holmes, Aurelia Moser | URL: http://ire.org/events-and-training/event/1494/1768/",International 10,False
,Making data-informed design decisions,2015-03-07,11:20 a.m.,2015-03-07,12:20 p.m.,False,"Speakers: Tyler Fisher, Josh Kadis | URL: http://ire.org/events-and-training/event/1494/1766/",International 6-7,False
web development,Automate your development life: Build and deploy with Yeoman and Grunt,2015-03-07,2:10 p.m.,2015-03-07,3:10 p.m.,False,Speakers: Ryan Murphy | URL: http://ire.org/events-and-training/event/1494/1670/,M106,False
maps,Introduction to mapping: Importing and displaying data geographically with QGIS,2015-03-07,2:10 p.m.,2015-03-07,3:10 p.m.,False,Speakers: Peter Aldhous | URL: http://ire.org/events-and-training/event/1494/1668/,M102,False
python,Web scraping using Python (repeat session),2015-03-07,2:10 p.m.,2015-03-07,3:10 p.m.,False,Speakers: Paul Schreiber | URL: http://ire.org/events-and-training/event/1494/1667/,M101,False
,Mini Boot Camp (Saturday) *pre-registered attendees only,2015-03-07,2:10 p.m.,2015-03-07,5:30 p.m.,False,"Speakers: Denise Malan, Liz Lucas - This is a continuation of Friday's hands-on workshop. &nbsp;Preregistered attendees only. | URL: http://ire.org/events-and-training/event/1494/1604/",M103/M105,False
,Twitter Bootstrap: Responsive website framework,2015-03-07,2:10 p.m.,2015-03-07,3:10 p.m.,False,Speakers: Erika Lee | URL: http://ire.org/events-and-training/event/1494/1671/,M107,False
,How to draw the Internet: Better interactives through paper prototyping,2015-03-07,2:10 p.m.,2015-03-07,3:10 p.m.,False,"Speakers: Noah Veltman, Sisi Wei | URL: http://ire.org/events-and-training/event/1494/1773/",International 10,False
,Data negotiation: To FOIA or not to FOIA,2015-03-07,2:10 p.m.,2015-03-07,3:10 p.m.,False,Speakers: TBA | URL: http://ire.org/events-and-training/event/1494/1772/,International 8-9,False
,Spotlight: Talking about uncertainty,2015-03-07,2:10 p.m.,2015-03-07,3:10 p.m.,False,Speakers: Jordan Ellenberg | URL: http://ire.org/events-and-training/event/1494/1771/,International 6-7,False
,Catching fire: Spreading data journalism throughout the newsroom,2015-03-07,2:10 p.m.,2015-03-07,3:10 p.m.,False,"Speakers: Emma Carew Grovum, Jeff Ernsthausen, Jodi Upton | URL: http://ire.org/events-and-training/event/1494/1770/",International 4-5,False
,"So they bought a federal candidate, now what?",2015-03-07,2:10 p.m.,2015-03-07,3:10 p.m.,False,"Speakers: Ben Wieder, Jacob Fenton - *Moderated by Benjamin Wieder, The Center for Public Integrity | URL: http://ire.org/events-and-training/event/1494/1769/",International 2-3,False
python,Getting started with Python (hands-on),2015-03-07,2:10 p.m.,2015-03-07,3:10 p.m.,False,Speakers: TBA | URL: http://ire.org/events-and-training/event/1494/1802/,M104,False
databases,Getting started with SQLite,2015-03-07,2:10 p.m.,2015-03-07,3:10 p.m.,False,Speakers: Troy Thibodeaux | URL: http://ire.org/events-and-training/event/1494/1669/,M109,False
maps,Mapping 2: Manipulating and editing geographic data with QGIS,2015-03-07,3:20 p.m.,2015-03-07,4:20 p.m.,False,Speakers: Michael Corey | URL: http://ire.org/events-and-training/event/1494/1673/,M102,False
,Teach yourself to code (repeat session),2015-03-07,3:20 p.m.,2015-03-07,4:20 p.m.,False,Speakers: Becca Aaronson | URL: http://ire.org/events-and-training/event/1494/1672/,M101,False
databases,Summing and grouping in SQLite,2015-03-07,3:20 p.m.,2015-03-07,4:20 p.m.,False,Speakers: Troy Thibodeaux | URL: http://ire.org/events-and-training/event/1494/1674/,M109,False
,Visualizing your data with R (repeat session),2015-03-07,3:20 p.m.,2015-03-07,4:20 p.m.,False,Speakers: Ronald Campbell | URL: http://ire.org/events-and-training/event/1494/1676/,M107,False
